{
  "schemaVersion": "0.1.0",
  "storyId": "zhang-qian-yuezhi",
  "contentRevision": 4,
  "sources": [
    {
      "id": "shiji-mission",
      "title": "出使缘起与途中被留",
      "type": "book",
      "locator": {
        "url": "https://zh.wikisource.org/wiki/史記/卷123#張騫",
        "localPath": null
      },
      "citation": "《史记》卷123〈张骞〉第一段，维基文库数字文本",
      "location": "《史记》卷123〈张骞〉第一段",
      "excerpt": "月氏遁逃而常怨仇匈奴，無與共擊之。漢方欲事滅胡，聞此言，因欲通使。……留騫十餘歲，與妻，有子，然騫持漢節不失。",
      "rights": "古籍数字转录页面标示CC BY-SA；保留出处，正式发布仍待权利与底本复核",
      "accessedAt": "2026-10-01"
    },
    {
      "id": "shiji-arrival",
      "title": "抵达的叙事顺序",
      "type": "book",
      "locator": {
        "url": "https://zh.wikisource.org/wiki/史記/卷123#張騫",
        "localPath": null
      },
      "citation": "《史记》卷123〈张骞〉第二段，维基文库数字文本",
      "location": "《史记》卷123〈张骞〉第二段",
      "excerpt": "騫因與其屬亡鄉月氏，西走數十日至大宛。……抵康居，康居傳致大月氏。",
      "rights": "古籍数字转录页面标示CC BY-SA；保留出处，正式发布仍待权利与底本复核",
      "accessedAt": "2026-10-01"
    },
    {
      "id": "shiji-disposition",
      "title": "月氏处境与出使结果",
      "type": "book",
      "locator": {
        "url": "https://zh.wikisource.org/wiki/史記/卷123#張騫",
        "localPath": null
      },
      "citation": "《史记》卷123〈张骞〉第二段，维基文库数字文本",
      "location": "《史记》卷123〈张骞〉第二段",
      "excerpt": "地肥饒，少寇，志安樂，又自以遠漢，殊無報胡之心。騫從月氏至大夏，竟不能得月氏要領。",
      "rights": "古籍数字转录页面标示CC BY-SA；保留出处，正式发布仍待权利与底本复核",
      "accessedAt": "2026-10-01"
    },
    {
      "id": "shiji-report",
      "title": "返回与报告见闻",
      "type": "book",
      "locator": {
        "url": "https://zh.wikisource.org/wiki/史記/卷123#張騫",
        "localPath": null
      },
      "citation": "《史记》卷123〈张骞〉第三段及下文，维基文库数字文本",
      "location": "《史记》卷123〈张骞〉第三段及下文",
      "excerpt": "騫身所至者大宛、大月氏、大夏、康居，而傳聞其旁大國五六，具為天子言之。",
      "rights": "古籍数字转录页面标示CC BY-SA；保留出处，正式发布仍待权利与底本复核",
      "accessedAt": "2026-10-01"
    },
    {
      "id": "shiji-stay",
      "title": "一年多的区域活动",
      "type": "book",
      "locator": {
        "url": "https://zh.wikisource.org/wiki/史記/卷123#張騫",
        "localPath": null
      },
      "citation": "《史记》卷123〈张骞〉第二、三段，维基文库数字文本",
      "location": "《史记》卷123〈张骞〉第二、三段",
      "excerpt": "騫從月氏至大夏，竟不能得月氏要領。留歲餘，還。",
      "rights": "古籍数字转录页面标示CC BY-SA；保留出处，正式发布仍待权利与底本复核",
      "accessedAt": "2026-10-01"
    },
    {
      "id": "shiji-region",
      "title": "月氏迁居、与大夏的关系及不同生活背景",
      "type": "book",
      "locator": {
        "url": "https://zh.wikisource.org/wiki/史記/卷123",
        "localPath": null
      },
      "citation": "《史记》卷123：大月氏条（迁居、臣属与生活），大夏条（城屋与市场），维基文库数字文本",
      "location": "《史记》卷123：大月氏条（迁居、臣属与生活），大夏条（城屋与市场）",
      "excerpt": "大月氏……其南則大夏……行國也，隨畜移徙，與匈奴同俗。……始月氏居敦煌、祁連閒，及為匈奴所敗，乃遠去，過宛，西擊大夏而臣之，遂都媯水北，為王庭。……大夏……其俗土著，有城屋。……其都曰藍市城，有市販賈諸物。",
      "rights": "古籍数字转录页面标示CC BY-SA；保留出处，正式发布仍待权利与底本复核",
      "accessedAt": "2026-10-01"
    },
    {
      "id": "shiji-market",
      "title": "邛竹杖、蜀布与身毒来源",
      "type": "book",
      "locator": {
        "url": "https://zh.wikisource.org/wiki/史記/卷123",
        "localPath": null
      },
      "citation": "《史记》卷123：张骞报告大夏见闻段，维基文库数字文本",
      "location": "《史记》卷123：张骞报告大夏见闻段",
      "excerpt": "臣在大夏時，見邛竹杖、蜀布。問曰：「安得此？」大夏國人曰：「吾賈人往市之身毒。」",
      "rights": "古籍数字转录页面标示CC BY-SA；保留出处，正式发布仍待权利与底本复核",
      "accessedAt": "2026-10-01"
    },
    {
      "id": "shiji-shendu",
      "title": "大夏国人所述身毒方位与风土",
      "type": "book",
      "locator": {
        "url": "https://zh.wikisource.org/wiki/史記/卷123",
        "localPath": null
      },
      "citation": "《史记》卷123：张骞报告大夏见闻段，大夏国人答问接“吾贾人往市之身毒”，维基文库数字文本",
      "location": "《史记》卷123：张骞报告大夏见闻段，大夏国人答问接“吾贾人往市之身毒”",
      "excerpt": "吾賈人往市之身毒。身毒在大夏東南可數千里。其俗土著，大與大夏同，而卑溼暑熱云。",
      "rights": "古籍数字转录页面标示CC BY-SA；保留出处，正式发布仍待权利与底本复核",
      "accessedAt": "2026-10-01"
    },
    {
      "id": "hanshu-variant",
      "title": "月氏继位者的文本分歧",
      "type": "book",
      "locator": {
        "url": "https://zh.wikisource.org/wiki/漢書/卷061",
        "localPath": null
      },
      "citation": "《汉书》卷61〈张骞〉第二段，与《史记》对读，维基文库数字文本",
      "location": "《汉书》卷61〈张骞〉第二段，与《史记》对读",
      "excerpt": "大月氏王已爲胡所殺，立其夫人爲王。",
      "rights": "古籍数字转录页面标示CC BY-SA；保留出处，正式发布仍待权利与底本复核",
      "accessedAt": "2026-10-01"
    },
    {
      "id": "xiongnu-belt-met",
      "title": "Met，Belt Plaque with Dragon and Tortoises",
      "type": "museum",
      "locator": {
        "url": "https://www.metmuseum.org/art/collection/search/65231",
        "localPath": null
      },
      "citation": "Met，Belt Plaque with Dragon and Tortoises",
      "location": "前2–1世纪；博物馆列为匈奴文化、中国西北；铜鎏金，8.9×4.4厘米",
      "excerpt": "矩形金属带牌、动物装饰、材质与尺寸",
      "rights": "本轮仅引用研究与馆藏链接，未下载或复用第三方图像；形貌服装为跨材料/跨期推定。",
      "accessedAt": "2026-10-01"
    },
    {
      "id": "xiongnu-cap-yaloman",
      "title": "Tishkin / Orfinskaya，Yaloman II Mound 51 头饰织物研究",
      "type": "paper",
      "locator": {
        "url": "https://archaeology.nsc.ru/en/publications/jr-aeae-en/23-51-1/annot-12/",
        "localPath": null
      },
      "citation": "Tishkin / Orfinskaya，Yaloman II Mound 51 头饰织物研究",
      "location": "阿尔泰；研究定为匈奴时期，200 BCE–100 CE；丝织品显微与年代分析",
      "excerpt": "彩色丝织物用于 cap / bonnet 型贴头帽，属于较有地位者材料",
      "rights": "本轮仅引用研究与馆藏链接，未下载或复用第三方图像；形貌服装为跨材料/跨期推定。",
      "accessedAt": "2026-10-01"
    },
    {
      "id": "xiongnu-robe-noinula",
      "title": "Polosmak，Noin-Ula 22号墓服装新发现",
      "type": "paper",
      "locator": {
        "url": "https://sciact.archaeology.nsc.ru/public/article/2490",
        "localPath": null
      },
      "citation": "Polosmak，Noin-Ula 22号墓服装新发现",
      "location": "公元1世纪初；匈奴贵族墓；本轮核读论文摘要",
      "excerpt": "袍片与系带、右向闭合的袍式、毛织独立裤腿",
      "rights": "本轮仅引用研究与馆藏链接，未下载或复用第三方图像；形貌服装为跨材料/跨期推定。",
      "accessedAt": "2026-10-01"
    },
    {
      "id": "xiongnu-boots-noinula",
      "title": "发掘者 Natalia Polosmak，Steppe Fashion",
      "type": "paper",
      "locator": {
        "url": "https://www.scfh.ru/en/papers/steppe-fashion-/",
        "localPath": null
      },
      "citation": "发掘者 Natalia Polosmak，Steppe Fashion",
      "location": "Noin-Ula 22号墓，前1世纪末–公元1世纪初；另对照6号墓；本轮核读全文",
      "excerpt": "毛织套腿与毡靴连用，套腿以带子固定；6号墓丝质套腿与低筒毡靴",
      "rights": "本轮仅引用研究与馆藏链接，未下载或复用第三方图像；形貌服装为跨材料/跨期推定。",
      "accessedAt": "2026-10-01"
    }
  ]
}
